titre,lien,citation,pdflink,auteurEditeur,cite,version
[HTML][HTML] Nature and diffusion of COVID-19–related oral health information on Chinese social media: analysis of tweets on weibo,https://www.jmir.org/2020/6/e19981,"… Nature and Diffusion of COVID-19–related Oral Health Information on Chinese Social Media:
Analysis of Tweets on Weibo … Background: Social media has become increasingly important as
a source of information for the public and is widely used for health-related information … 
",,"ZY Tao, G Chu, C McGrath, F Hua, YY Leung… - Journal of medical …, 2020 - jmir.org",Cited by 11,All 12 versions
Pandemic populism: Facebook pages of alternative news media and the corona crisis--A computational content analysis,https://arxiv.org/pdf/2004.02566,"… own ideological spin. Such voices have been criticized for furthering societal
confusion and spreading potentially dangerous “fake news” or conspiracy theories
via social media and other online channels. The current study … 
",https://arxiv.org/pdf/2004.02566,"S Boberg, T Quandt, T Schatto-Eckrodt… - arXiv preprint arXiv …, 2020 - arxiv.org",Cited by 47,All 5 versions
[HTML][HTML] Using the president's tweets to understand political diversion in the age of social media,https://www.nature.com/articles/s41467-020-19644-6,"… Greater spread of misinformation and conspiracy theories on Twitter are associated with lower
vaccination rates 13 . Similarly, fake news (fabricated stories that are presented as news on social
media) have controlled the popularity of many issues in US politics 14 , mainly … 
",,"S Lewandowsky, M Jetter, UKH Ecker - Nature communications, 2020 - nature.com",Cited by 6,All 12 versions
"Challenges in Combating COVID-19 Infodemic--Data, Tools, and Ethics",https://arxiv.org/pdf/2005.13691,"… Those arXiv:2005.13691v1 [cs.SI] 27 May 2020 Page 2. conspiracy theories have
appeared in both social media and mainstream news outlets and are often intertwined
with geopolitics. One example is about how the new coron … 
",https://arxiv.org/pdf/2005.13691,"K Ding, K Shu, Y Li, A Bhattacharjee, H Liu - arXiv preprint arXiv …, 2020 - arxiv.org",Cited by 4,All 4 versions
The FPM International Awards for Medical Writing in Social Media: a step in the right direction,https://pmj.bmj.com/content/96/1135/304.abstract,"… disease (COVID-19) pandemic escalates, we see more and more medical misinformation being
circulated online, from conspiracy theories regarding the … its journals to launch international awards
for 'well-informed, clear writing on health matters in social media' may encourage … 
",,"SP Trethewey, KJ Beck, RF Symonds - Postgraduate medical journal, 2020 - pmj.bmj.com",,All 6 versions
The Importance of Interactions Between Content Characteristics and Creator Characteristics for Studying Virality in Social Media,https://pubsonline.informs.org/doi/abs/10.1287/isre.2019.0903,"… 2.2. Creator Characteristics Characteristics of the creator (ie, the person who posts the message
on social media) also have a clear effect on the message's … All of us have at least one gullible
friend or relative who has a history of posting rumors or conspiracy theories online and … 
",,"Y Han, T Lappas, G Sabnis - Information Systems Research, 2020 - pubsonline.informs.org",Cited by 1,All 4 versions
Media of contempt: Social media consumption predicts normative acceptance of anti-Muslim hate speech and islamoprejudice,https://www.ijcv.org/index.php/ijcv/article/download/3774/3840,"… In all these instances of xenophobic, extremist and racist terrorism, social media seemed to play
a crucial role – as a source of conspiracy theories about world events, as a catalyzer of
radicalization, and as a trans- mitter allowing the extremist to publicize his violent actions … 
",https://www.ijcv.org/index.php/ijcv/article/download/3774/3840,"W Soral, J Liu, M Bilewicz - International Journal of Conflict and Violence …, 2020 - ijcv.org",Cited by 2,All 4 versions
From networking to mitigation: the role of social media and analytics in combating the COVID-19 pandemic,https://www.tandfonline.com/doi/abs/10.1080/10580530.2020.1820635,"… There are several significant challenges in automatic detection of misinformation on social media.
First, misinformation can come in different forms, such as rumors, conspiracy theories, and
falsified facts. Each may require different types of detection models … 
",,"D Zhang, L Zhou, J Lim - Information Systems Management, 2020 - Taylor & Francis",Cited by 1,
"Beliefs in conspiracy theories, intolerance of uncertainty, and moral disengagement during the coronavirus crisis",https://www.researchgate.net/profile/Andrei-Holman-2/publication/345977491_Beliefs_in_conspiracy_theories_intolerance_of_uncertainty_and_moral_disengagement_during_the_coronavirus_crisis/links/5ffacf4e92851c13fe003c48/Beliefs-in-conspiracy-theories-intolerance-of-uncertainty-and-moral-disengagement-during-the-coronavirus-crisis.pdf,"… We advertised our study using formal and informal online groups set on social media platforms
(ie, groups related to the local university). Beliefs in conspiracy theories, intolerance of
uncertainty, and moral disengagement during the coronavirus crisis … 
",https://www.researchgate.net/profile/Andrei-Holman-2/publication/345977491_Beliefs_in_conspiracy_theories_intolerance_of_uncertainty_and_moral_disengagement_during_the_coronavirus_crisis/links/5ffacf4e92851c13fe003c48/Beliefs-in-conspiracy-theories-intolerance-of-uncertainty-and-moral-disengagement-during-the-coronavirus-crisis.pdf,"A Maftei, AC Holman - Ethics & Behavior, 2020 - Taylor & Francis",Cited by 1,All 3 versions
Critical impact of social networks infodemic on defeating coronavirus COVID-19 pandemic: Twitter-based study and research directions,https://arxiv.org/pdf/2005.08820,"… The widespread of the Coronavirus COVID-19 resulted with a tsunami of social media. Most
platforms were used to transmit relevant news, guidelines and precautions to people. According
to WHO, uncon- trolled conspiracy theories and propaganda are spreading faster than … 
",https://arxiv.org/pdf/2005.08820,"A Mourad, A Srour, H Harmanai… - … on Network and …, 2020 - ieeexplore.ieee.org",Cited by 14,All 5 versions
The COVID-19 Pandemic,https://www.jstor.org/stable/pdf/26915444.pdf,"… Since its outbreak, the COVID-19 pandemic has been at the fore-front of terrorist groups' social
media messaging. Spinning the spread of the contagion as God's wrath on their enemies, extremist
groups are promoting racial hatred, apocalyptic conspiracy theories and end-of … 
",https://www.jstor.org/stable/pdf/26915444.pdf,"A Basit - Counter Terrorist Trends and Analyses, 2020 - JSTOR",Cited by 5,All 3 versions
Different conspiracy theories have different psychological and social determinants: Comparison of three theories about the origins of the COVID-19 virus in a …,https://psyarxiv.com/mz5sw/download?format=pdf,"… conspiracy theories. In particular, we demonstrate that motivated reasoning plays
an important role in belief in some of the COVID-19 conspiracy theories propagated
via social media and other “news” outlets. Finally, we find … 
",https://psyarxiv.com/mz5sw/download?format=pdf,"TK Hartman, M Marshall, TVA Stocks, R McKay… - 2020 - psyarxiv.com",,
Tweeting the Russian revolution: RT's# 1917LIVE and social media re-enactments as public diplomacy,https://www.researchgate.net/profile/Rhys_Crilley2/publication/336280588_Tweeting_the_Russian_revolution_RT%27s_1917LIVE_and_social_media_re-enactments_as_public_diplomacy/links/5df29514a6fdcc28371d193d/Tweeting-the-Russian-revolution-RTs-1917LIVE-and-social-media-re-enactments-as-public-diplomacy.pdf,"… Format, Tips on citation download. Download Citation. Download article citation data for: Tweeting
the Russian revolution: RT's #1917LIVE and social media re-enactments as public diplomacy.
Rhys Crilley, Marie Gillespie, and Alistair Willis … Share this article via social media … 
",https://www.researchgate.net/profile/Rhys_Crilley2/publication/336280588_Tweeting_the_Russian_revolution_RT%27s_1917LIVE_and_social_media_re-enactments_as_public_diplomacy/links/5df29514a6fdcc28371d193d/Tweeting-the-Russian-revolution-RTs-1917LIVE-and-social-media-re-enactments-as-public-diplomacy.pdf,"R Crilley, M Gillespie, A Willis - European journal of cultural …, 2020 - journals.sagepub.com",Cited by 14,All 4 versions
Political and Social Impact of Digital Fake News in an Era of Social Media,https://books.google.com/books?hl=en&lr=&id=C87LDwAAQBAJ&oi=fnd&pg=PA43&dq=%22social+media%22+AND+%22conspiracy+theories%22&ots=4bgA_oFfuu&sig=3kIsT6sl_OCSjPSAm8mOy9lHbNA,"… the content of that article continued to spread, mixing with conspiracy theories and displaying
typical characteristics we see today of fake news. Furthermore, Chiou and Tucker's (2018) study
shows that advertising has an impact on the popularity of fake news on social media … 
",,"F Safieddine - … an Era of Social Media: Tracking Viral Contagion, 2020 - books.google.com",,
How to Control Coronavirus Conspiracy Theories in Twitter? A Systems Thinking and Social Networks Modeling Approach,https://ieeexplore.ieee.org/abstract/document/9378400/,"… comment, tweet, or story [1]. However, the features mentioned in [1] are not sufficient to track down
any conspiracy theories and stem … Understanding how the systems topics in social media would
work makes the fact-checkers analysis more proactive and function better for … 
",,"M Alassad, MN Hussain… - 2020 IEEE International …, 2020 - ieeexplore.ieee.org",,All 2 versions
"[PDF][PDF] Birtherism, Benghazi and QAnon: Why Conspiracy Theories Pose a Threat to American Democracy",https://scholarship.depauw.edu/cgi/viewcontent.cgi?article=1158&context=studentresearch,"… One of the most prominent norms that Trump fails to follow is his consistent spreading
of conspiracy theories on social media, which leads to the spread of misinformation
among the public, yet another example of how conspiracy … 
",https://scholarship.depauw.edu/cgi/viewcontent.cgi?article=1158&context=studentresearch,E Schabes - 2020 - scholarship.depauw.edu,Cited by 2,
The Parallax View: How Conspiracy Theories and Belief in Conspiracy Shape American Politics,https://digitalcommons.bard.edu/senproj_s2020/236/,"… Senior Projects Spring 2020. Title. The Parallax View: How Conspiracy Theories and Belief in
Conspiracy Shape American Politics … Project Advisor 2. Richard Aldous. Abstract/Artist's Statement.
Conspiracy theories have become a fact of American political discourse … 
",,LE Shaffer - 2020 - digitalcommons.bard.edu,,
Social media and the Covid-19 pandemic: Observations from Nigeria,https://www.tandfonline.com/doi/pdf/10.1080/23311983.2020.1799483,"… To this end, social media platforms have become a front in the spread of information about the
virus from the religious perspective … Some churches have also devised conspiracy theories about
the state, the world and the church, suddenly marking out the pandemic as a fight … 
",https://www.tandfonline.com/doi/pdf/10.1080/23311983.2020.1799483,"NA Obi-Ani, C Anikwenze, MC Isiani - Cogent Arts & Humanities, 2020 - Taylor & Francis",Cited by 8,All 4 versions
[PDF][PDF] Overview of CheckThat! 2020 English: Automatic identification and verification of claims in social media,http://www.dei.unipd.it/~ferro/CLEF-WN-Drafts/CLEF2020/paper_265.pdf,"… 54], which has credibility annotations, as well as work on fake news [71] and on rumor detection
in social media [85]; unlike … to potential cures, updates on number of cases, on measures taken
by governments, or discussing rumors and spreading conspiracy theories should be … 
",http://www.dei.unipd.it/~ferro/CLEF-WN-Drafts/CLEF2020/paper_265.pdf,"S Shaar, A Nikolov, N Babulkov, F Alam… - Cappellato et al …, 2020 - dei.unipd.it",Cited by 12,All 4 versions
[PDF][PDF] Extremist Manifestation: Translation of Conspiracy Theories,https://americanctri.org/wp-content/uploads/2020/11/Extremist-Manifestation-and-Translation-of-Conspiracy-Theories-Perspective.pdf,"… audiences. Contrarily, some have interpreted this approach as a political tactic by
Qanon to gain supporters and then rapidly push conspiracy theories through social
media groups that are likely to be accepted. Research also … 
",https://americanctri.org/wp-content/uploads/2020/11/Extremist-Manifestation-and-Translation-of-Conspiracy-Theories-Perspective.pdf,"A Mohammed, A Garry, R Mohamed, A Andary - 2020 - americanctri.org",,
[PDF][PDF] Conspiracy theories in the classroom-How to deal with these issues as a teacher,https://lirias.kuleuven.be/retrieve/594076,"… Page 8. 8 FAKE NEWS OR CONSPIRACY? Not all fake news is part of a conspiracy and not
all conspiracy theories can be traced back to fabricated news items that were spread on social
media. However, there is considerable overlap between the two … 
",https://lirias.kuleuven.be/retrieve/594076,"F Nollet, J Tanja - 2020 - lirias.kuleuven.be",,
Going viral: How a single tweet spawned a COVID-19 conspiracy theory on Twitter,https://journals.sagepub.com/doi/full/10.1177/2053951720938405,"… Share this article via social media. The e-mail addresses that you supply to use this
service will not be used for any other purpose without your consent. Recommend
to a friend. Email a link to the following content: *Recipient's … 
",,"A Gruzd, P Mai - Big Data & Society, 2020 - journals.sagepub.com",Cited by 34,
[PDF][PDF] COVID CT: Analysis and Detection of Different Conspiracy Theories on YouTube in the context of COVID-19,http://events.kmi.open.ac.uk/misinformation/assets/accepted-papers/COVID_CT.pdf,"… arXiv preprint arXiv:2006.11343 (2020) Page 4. 4 GKShahi et al. 7. Shahsavari, S., Holur,
P., Tangherlini, TR, Roychowdhury, V.: Conspiracy in the time of corona: Automatic detection
of covid-19 conspiracy theories in social media and the news … 
",http://events.kmi.open.ac.uk/misinformation/assets/accepted-papers/COVID_CT.pdf,"GK Shahi, D Röchert, S Stieglitz - events.kmi.open.ac.uk",,All 2 versions
"COVID-19, its novel vaccination and fake news–What a brew",https://www.ncbi.nlm.nih.gov/pmc/articles/pmc7659985/,"… It has been widely argued that science must face a reality check and not eschew the utilisation
of social media in order to … of how public health authorities can respond most constructively in
the context of the COVID-19 pandemic to meet both conspiracy theories and therapeutic … 
",,"M Scerri, V Grech - Early Human Development, 2020 - Elsevier",Cited by 2,All 7 versions
False equivalencies: Online activism from left to right,http://dfreelon.org/publications/2020_False_equivalencies_Online_activism_from_left_to_right.pdf,"… and conspiracy theories more than the left, more research is needed to reveal the magnitude
and character of left-wing disinformation. Such ideological asymmetries between left- and
right-wing activism hold critical implications for democratic practice, social media governance … 
",http://dfreelon.org/publications/2020_False_equivalencies_Online_activism_from_left_to_right.pdf,"D Freelon, A Marwick, D Kreiss - Science, 2020 - science.sciencemag.org",Cited by 12,All 7 versions
Social representations of sociopolitical groups on r/The_Donald and emergent conflict narratives: A qualitative content analysis,https://osf.io/nw8kf/download?format=pdf,"… Social media has been integral for the organization and success of right‐wing populist movements
in the United States and Europe … The results showed that the majority of posts discussed liberals,
race relations, and conspiracy theories, and in these posts, liberals and liberal … 
",https://osf.io/nw8kf/download?format=pdf,"Q McLamore, ÖM Uluğ - Analyses of Social Issues and Public …, 2020 - Wiley Online Library",Cited by 3,All 3 versions
Conspiracy Theories and Modern Disjuncture Amidst COVID-19 in Indonesia,http://jmi.ipsk.lipi.go.id/index.php/jmiipsk/article/download/909/587,"… Jerinx is not the only social media persona that entertain conspiracy theories in Indonesia …
In USA, it is found that social media influencers plays a big role in the propagation of
conspiracy theories to wide audiences (Gruzd & Mai, 2020) … 
",http://jmi.ipsk.lipi.go.id/index.php/jmiipsk/article/download/909/587,"I Nadzir - Masyarakat Indonesia, 2020 - jmi.ipsk.lipi.go.id",,
Disguised propaganda from digital to social media,http://ls00012.mah.se/bitstream/handle/2043/25893/PrePrint-FarkasNeumayer-Chapter.pdf?sequence=2&isAllowed=y,"… A key application of bots was to disseminate conspiracy theories and disinformation, popularly
referred to as “fake news” (Shao et al … As with all disguised propaganda on social media, platforms'
decentralized mode of content proliferation and potential anonymity provided for … 
",http://ls00012.mah.se/bitstream/handle/2043/25893/PrePrint-FarkasNeumayer-Chapter.pdf?sequence=2&isAllowed=y,"J Farkas, C Neumayer - Second international handbook of internet …, 2020 - Springer",Cited by 11,All 12 versions
Tackling “conspiracy” theories after the January 2015 terrorist attacks in Paris,https://journals.sagepub.com/doi/abs/10.1177/0392192120924537,"… Tips on citation download. Download Citation. Download article citation data for: Tackling
“conspiracy” theories after the January 2015 terrorist attacks in Paris. Emmanuel Kreis. Diogenes
0 10.1177/0392192120924537. Share. Share … Share this article via social media … 
",,"E Kreis - Diogenes, 2020 - journals.sagepub.com",,All 2 versions
[HTML][HTML] The Twitter origins and evolution of the COVID-19 “plandemic” conspiracy theory,https://misinforeview.hks.harvard.edu/article/the-twitter-origins-and-evolution-of-the-covid-19-plandemic-conspiracy-theory/,"… a pro-active, responsive, and multi-pronged effort to fight misinformation, specifically: 1)
preemptively addressing misinformation about the COVID-19 vaccine now 2) ongoing monitoring
and surveillance of social media platforms for emerging conspiracy theories, 3) censoring … 
",,"MD Kearney, SC Chiang… - Harvard Kennedy …, 2020 - misinforeview.hks.harvard.edu",Cited by 3,All 3 versions
"'Hello, world': GCHQ, Twitter and social media engagement",https://www.tandfonline.com/doi/abs/10.1080/02684527.2020.1713434,"… This article posits that, while the use of social media has allowed the agency to reach out to a
new tech-savvy generation, its presence on the platform can sometimes stoke and amplify
conspiracy theories affecting issues such as brand identity as GCHQ adopts a new, media … 
",,"L McLoughlin, S Ward, DWB Lomas - Intelligence and National …, 2020 - Taylor & Francis",Cited by 1,All 5 versions
Popular conspiracy theories in Slovakia and the Czech Republic,https://journals.sagepub.com/doi/abs/10.1177/0392192120945614,"… Tips on citation download. Download Citation. Download article citation data for: Popular
conspiracy theories in Slovakia and the Czech Republic. Zuzana Panczová and Petr Janeček.
Diogenes 0 10.1177/0392192120945614. Share. Share … Share this article via social media … 
",,"Z Panczová, P Janeček - Diogenes, 2020 - journals.sagepub.com",,All 2 versions
[HTML][HTML] Inoculating Against Fake News About COVID-19,https://www.frontiersin.org/articles/10.3389/fpsyg.2020.566790/full,"… Misinformation about COVID-19 has proliferated widely on social media, ranging from the peddling
of fake “cures,” such as gargling with lemon or salt water and injecting yourself with bleach (World
Health Organization, 2020a), to false conspiracy theories that the virus was … 
",,"S van der Linden, J Roozenbeek… - Frontiers in Psychology, 2020 - frontiersin.org",Cited by 22,All 14 versions
[HTML][HTML] Understanding Detrimental Aspects of Social Media Use: Will the Real Culprits Please Stand Up?,https://www.frontiersin.org/articles/10.3389/fsoc.2020.599270/full?utm_source=F-AAE&utm_medium=EMLF&utm_campaign=MRK_1513178_75_Sociol_20201222_arts_A,"… building of a social media architecture that does not endanger democratic processes (Shahrezaye
et al., 2019; Papakyriakopoulos et al., 2020b) or fosters sexism (Papakyriakopoulos et al., 2020a),
radicalization or “fake news” and conspiracy theories (Papakyriakopoulos et al … 
",,"C Montag, S Hegelich - Frontiers in Sociology, 2020 - frontiersin.org",Cited by 3,All 2 versions
"Is the worship of celebrities associated with resistance to vaccinations? Relationships between celebrity admiration, anti-vaccination attitudes, and beliefs in …",https://www.researchgate.net/profile/Ho_Huynh/publication/342285938_Is_the_worship_of_celebrities_associated_with_resistance_to_vaccinations_Relationships_between_celebrity_admiration_anti-vaccination_attitudes_and_beliefs_in_conspiracy/links/5f91d0f6458515b7cf96a20a/Is-the-worship-of-celebrities-associated-with-resistance-to-vaccinations-Relationships-between-celebrity-admiration-anti-vaccination-attitudes-and-beliefs-in-conspiracy.pdf,"… sciences research because MTurk participants perform just as well on study tasks as participants
who are recruited via social media and participants … Belief in Conspiracy Theories was measured
using a single item scale: 'I think that the official version of the events given by the … 
",https://www.researchgate.net/profile/Ho_Huynh/publication/342285938_Is_the_worship_of_celebrities_associated_with_resistance_to_vaccinations_Relationships_between_celebrity_admiration_anti-vaccination_attitudes_and_beliefs_in_conspiracy/links/5f91d0f6458515b7cf96a20a/Is-the-worship-of-celebrities-associated-with-resistance-to-vaccinations-Relationships-between-celebrity-admiration-anti-vaccination-attitudes-and-beliefs-in-conspiracy.pdf,"L Martinez-Berman, L McCutcheon… - Psychology, health & …, 2020 - Taylor & Francis",Cited by 7,All 4 versions
"[PDF][PDF] Conspiracy beliefs, chloroquine, and the rejection of vaccination: A conceptual replication-extension in the COVID-19 pandemic context",https://psyarxiv.com/rz78k/download?format=pdf,"… Page 4. Bertin et al. COVID-19 Conspiracy Theories and Vaccination treatment.
Given their prevalence on French social media, we moreover included
“pro-chloroquine” conspiracy beliefs among the independent variables … 
",https://psyarxiv.com/rz78k/download?format=pdf,"P Bertin, K Nera, S Delouvée - 2020 - psyarxiv.com",Cited by 8,All 3 versions
Irrational beliefs that spur conspiracy theories,http://erepo.usiu.ac.ke/handle/11732/6433,"… Abstract: Across our social media taglines in Facebook, WhatsApp, Telegram,
Instagram, and Twitter, most of us during the present Covid-19 pandemic have come
across often ridiculous conspiracy theories. From claims of … 
",,B Scott - 2020 - erepo.usiu.ac.ke,,All 2 versions
Spreading (dis) trust: Covid-19 misinformation and government intervention in Italy,https://www.cogitatiopress.com/mediaandcommunication/article/download/3219/3219,"… raged in Italy over the issue of vac- cinations, fueled by the activism of the anti-vax move- mentson
social media (Tipaldo,2019 … politicization of the topic, which meshed with the spread of populist
anti-elitism movements and the diffusion of conspiracy theories (Mancosu, Vassallo … 
",https://www.cogitatiopress.com/mediaandcommunication/article/download/3219/3219,"A Lovari - Media and Communication, 2020 - cogitatiopress.com",Cited by 23,All 8 versions
Tweeting on COVID-19 pandemic in South Africa: LDA-based topic modelling approach,https://www.tandfonline.com/doi/abs/10.1080/20421338.2020.1817262,"… place by the government, as we analyze discussions relating to COVID-19 using data harvested
from Twitter – social media and opinion … that alcohol sale and consumption, staying home, daily
statistics tracing, police brutality, 5G and vaccines conspiracy theories were among … 
",,"MB Mutanga, A Abayomi - African Journal of Science, Technology …, 2020 - Taylor & Francis",Cited by 2,
"Advertisers jump on coronavirus bandwagon: Politics, news, and business",https://arxiv.org/pdf/2003.00923,"… of Asian origin, prompting public statements from political leaders condemning racism3. Further,
unscrupulous parties are taking to the social media platforms to promote dubious claims of
remedies and cures4, while politicians are propagating conspiracy theories about the … 
",https://arxiv.org/pdf/2003.00923,"Y Mejova, K Kalimeri - arXiv preprint arXiv:2003.00923, 2020 - arxiv.org",Cited by 18,All 5 versions
"Network typology, information sources, and messages of the infodemic twitter network under COVID‐19",https://www.ncbi.nlm.nih.gov/pmc/articles/PMC7645854/,"Abstract During the COVID‐19 crisis, fake news, conspiracy theories, and
backlash against specific groups emerged and were largely diffused via social
media. This phenomenon has been described as a … 
",,"M Chong - Proceedings of the Association for Information …, 2020 - Wiley Online Library",Cited by 1,All 7 versions
[HTML][HTML] Antimicrobial Resistance in Canada: Promoting immunization resiliency in the digital information age,https://www.ncbi.nlm.nih.gov/pmc/articles/PMC6941923/,"… tactics, namely, conspiracy theories, fake experts, selectivity, demands that vaccines be 100%
safe and effective, misrepresentation and false logic. Third, avoid unproductive debates with
those who have strongly held views, both in person and when using social media … 
",,"NE MacDonald, E Dubé - Canada Communicable Disease Report, 2020 - ncbi.nlm.nih.gov",Cited by 7,All 6 versions
