titre,lien,citation,pdflink,auteurEditeur,cite,version
Difficult heritage and digital media:'selfie culture'and emotional practices at the Memorial to the Murdered Jews of Europe,https://www.tandfonline.com/doi/pdf/10.1080/13527258.2020.1768578,"… His project 'Yolocaust' went viral on social media and was recognised widely by the German
and international press … Although some of these comments take the video as a starting point for
lengthy explanations of conspiracy theories (Holocaust denial included) or discussing … 
",https://www.tandfonline.com/doi/pdf/10.1080/13527258.2020.1768578,"C Bareither - International Journal of Heritage Studies, 2020 - Taylor & Francis",Cited by 2,
Head is Where the Herd is: Fake News and Effect of Online Social Conformity on Islamophobia in Indians,https://papers.ssrn.com/sol3/papers.cfm?abstract_id=3651297,"… The toxic combination of fake news and social media has led to spread conspiracy theories against
the Muslim community and in extreme cases, even violence through social influence processes.
Social conformity affects the behaviour of people in the online sphere as well … 
",,"I Nagar, S Gill - 2020 - papers.ssrn.com",Cited by 1,
Disinformation as a threat to deliberative democracy,https://journals.sagepub.com/doi/abs/10.1177/1065912920938143,"… Share this article via social media. The e-mail addresses that you supply to use this
service will not be used for any other purpose without your consent. Recommend
to a friend. Email a link to the following content: *Recipient's … 
",,"S McKay, C Tenove - Political Research Quarterly, 2020 - journals.sagepub.com",Cited by 7,
Book Review: Not Born Yesterday: The Science of Who We Trust and What We Believe,https://journals.sagepub.com/doi/full/10.1177/1940161220983777,"… Share this article via social media. The e-mail addresses that you supply to use this
service will not be used for any other purpose without your consent. Recommend
to a friend. Email a link to the following content: *Recipient's … 
",,A Jungherr - 2020 - journals.sagepub.com,,
"The Nature, Cause and Consequence of COVID-19 Panic Among Social Media Users in India",https://psyarxiv.com/dgr45/download?format=pdf,"… Misleading information and conspiracy theories has been an integral part of panic, and social media
just adds the right medium for propaga- tion and spread of panic. There has been a steep rise
of moral panic [4] which was observed during multiple events earlier … 
",https://psyarxiv.com/dgr45/download?format=pdf,"C Bhattacharya, D Chowdhury, N Ahmed, S Ozgur… - 2020 - psyarxiv.com",,
Online users' attitudes toward fake news: Implications for brand management,https://onlinelibrary.wiley.com/doi/abs/10.1002/mar.21349,"… understand the effects of fake news on branding, deeper comprehension of fake news in the
context of social media is required … Ciampaglia, Varol, Flammini, and Menczer (2017) extended
this list of key terms to include “hoaxes, rumors, conspiracy theories, fabricated reports … 
",,"T Borges‐Tiago, F Tiago, O Silva… - Psychology & …, 2020 - Wiley Online Library",Cited by 8,
Natural stings: alternative health services selling distrust about vaccines on YouTube,https://osf.io/preprints/socarxiv/vtf5r/download,"… YouTube increasingly becomes one of the most popular social media services, reaching over
two billion 42 users each month (YouTube … 105 4. Morality: association between HPV vaccine
and promiscuity, and/or religious issues (M) 106 5. Conspiracy theories: narratives about … 
",https://osf.io/preprints/socarxiv/vtf5r/download,"DFT Machado, AF de Siqueira, L Gitahy - 2020 - osf.io",,All 5 versions
Critical perspectivism: educating for a moral response to media,https://www.tandfonline.com/doi/abs/10.1080/03057240.2020.1772213,"… It is true that a critically engaged individual should be able to seek out further appropriate,
academic research in order to debunk conspiracy theories, and indeed, social media is also
responsible for sharing stories of teens sneaking out to get vaccinated against their parents … 
",,"L D'Olimpio - Journal of Moral Education, 2020 - Taylor & Francis",,All 2 versions
[HTML][HTML] Managing 'digital China'during the Covid-19 pandemic: Nationalist stimulation and its backlash,https://link.springer.com/article/10.1007/s42438-020-00181-w,"… Taking Li's death as a tool to stir up anti-govt sentiment on Chinese social media is part of
overseas separatists' customary tactics … https://www.dailymail.co.uk/news/article-8231467/Chinas-
deadly-legacy-exposed-Major-new-series-sorts-coronavirus-conspiracy-theories-facts.html … 
",,"F Yan - Postdigital Science and Education, 2020 - Springer",Cited by 2,All 3 versions
Social Media and the Politics of Post-Truth,https://www.ceeol.com/search/article-detail?id=921107,"… and fuels all sorts of conspiracy theories. In 2016, in order to counter a growing number of
so-called “inadequate posts,” Facebook employed the help of third-party fact checkers which
were tasked with reporting potentially misleading posts. The social media platform assumed … 
",,"D Clinci - Analele Universităţii Ovidius din Constanţa. Seria …, 2020 - ceeol.com",,
"COVID-19 exposes digital divide, social stigma, and information crisis in Bangladesh",https://www.researchgate.net/profile/Abdul_Aziz93/publication/344882774_COVID-19_exposes_digital_divide_social_stigma_and_information_crisis_in_Bangladesh/links/5fc5eabc92851c30129960a9/COVID-19-exposes-digital-divide-social-stigma-and-information-crisis-in-Bangladesh.pdf,"… The sheer volume of misinformation, conspiracy theories, and fake news being shared through
social networking sites about the infection, symptoms, and hoax treatments. Many religiously
popular and social media celebrities propagate a narrative that virus is a soldier of Allah … 
",https://www.researchgate.net/profile/Abdul_Aziz93/publication/344882774_COVID-19_exposes_digital_divide_social_stigma_and_information_crisis_in_Bangladesh/links/5fc5eabc92851c30129960a9/COVID-19-exposes-digital-divide-social-stigma-and-information-crisis-in-Bangladesh.pdf,"A Aziz, MM Islam, M Zakaria - Media Asia, 2020 - Taylor & Francis",,All 4 versions
[PDF][PDF] Covid-Related Misinformation on YouTube,https://canucklaw.ca/wp-content/uploads/2020/09/covid.related.misinformation.on_.youtube.pdf,"… While all large social media platforms can host misinformation, research suggests that YouTube
has played a particularly important role as a source … in the United Kingdom, YouTube was the
information source that was most strongly associated with belief in conspiracy theories … 
",https://canucklaw.ca/wp-content/uploads/2020/09/covid.related.misinformation.on_.youtube.pdf,"A Knuutila, A Herasimenka, H Au, J Bright, PN Howard - 2020 - canucklaw.ca",Cited by 2,All 3 versions
Populism and the politics of misinformation,https://www.academia.edu/download/64084083/EB%20Samfundi%20proofs.pdf,"… In this new digital media environment, populist politicians have been able to spread conspiracy
theories and misinformation much further than … In addition, the proliferation of online media,
especially social media, undercut the gate-keeping role that mainstream reporting played … 
",https://www.academia.edu/download/64084083/EB%20Samfundi%20proofs.pdf,"E Bergmann - Safundi, 2020 - Taylor & Francis",Cited by 3,All 2 versions
"Facebook Pages, the “Disneyland” Measles Outbreak, and Promotion of Vaccine Refusal as a Civil Right, 2009–2019",https://ajph.aphapublications.org/doi/pdfplus/10.2105/AJPH.2020.305869,"… Others embrace conspiracy theories (emphasizing scientific, governmental, and pharmaceutical
malfeasance) or alternatives to Western medicine such as … 18 On the surface, social media seem
to reflect this community structure, with specific Facebook pages corresponding to … 
",https://ajph.aphapublications.org/doi/pdfplus/10.2105/AJPH.2020.305869,"DA Broniatowski, AM Jamison… - … Journal of Public …, 2020 - ajph.aphapublications.org",Cited by 2,All 7 versions
[HTML][HTML] Characterizing networks of propaganda on twitter: a case study,https://appliednetsci.springeropen.com/articles/10.1007/s41109-020-00286-y,"… contemporary advanced democracies experiencing a rise of anti-scientific thinking and reactionary
obscurantism, ranging from online conspiracy theories to the … openness” of the Internet (Lévy 2002)
has been taken over by a widespread concern that social media may instead … 
",,"S Guarino, N Trino, A Celestini… - Applied Network …, 2020 - appliednetsci.springeropen.com",Cited by 4,All 8 versions
SOCIAL MEDIA AND FAKE NEWS ON CORONA VIRUS: A REVIEW OF LITERATURE,http://www.rex.commpan.com/index.php/naujocom/article/viewFile/91/90,"… Notably, most fake news on Corona virus have centred on various conspiracy theories, resulting
in a plethora of incorrect ways of looking at the … home remedies like the use of Vitamin C, turmeric,
cow urine, etc., to mention a few, have all been disseminated on social media … 
",http://www.rex.commpan.com/index.php/naujocom/article/viewFile/91/90,"S Ukwuru, P Nwankwo - Nnamdi Azikiwe University Journal of …, 2020 - rex.commpan.com",,All 2 versions
(S) pin the flu vaccine: Recipes for concern,https://www.sciencedirect.com/science/article/pii/S0264410X20307738,"… 3. Results. The purpose of this study was to analyze flu vaccine related posts on the visual social
media platform Pinterest … Barriers: Civil liberties related to flu vaccine, 6.2% (n = 31). Barriers:
Conspiracy theories, 14.2% (n = 71). Government, 33.8% (n = 24). Medical, 33.8% (n = 24 … 
",,"JPD Guidry, IA Coman, EK Vraga, NH O'Donnell… - Vaccine, 2020 - Elsevier",,All 4 versions
The Role of Trust and Information in Adherence to Protective Behaviors & Conspiracy Thinking During the COVID-19 Pandemic and Infodemic_preprint,https://psyarxiv.com/chy4b/download?format=pdf,"… these authorities, but by trust in social media. We focused in particular on the COVID-19 creation
conspiracy theory -the idea that the virus is artificially created rather than naturally occurring-
which was one of the earliest and most mainstream COVID-19 conspiracy theories … 
",https://psyarxiv.com/chy4b/download?format=pdf,V van Mulukom - 2020 - psyarxiv.com,Cited by 1,All 4 versions
The Enemy of 'Ummah: Belief in Jewish conspiracy theories indirectly affected vaccination decisions,https://psyarxiv.com/53qsk/download?format=pdf,"… This study aimed to test our first prediction that a religiously zealous participant would be more
likely to endorse Jewish conspiracy theories through parallel mediating factors (symbolic … (76.3%
female) Indonesian Muslims by circulating invitations over several social media and … 
",https://psyarxiv.com/53qsk/download?format=pdf,"RA Zein, MF Arinda, AA Rikardi - 2020 - psyarxiv.com",,All 3 versions
"Social media, mutual aid and solidarity movements as a response to institutional breakdown",https://www.manchesterhive.com/view/9781526138125/9781526138125.00010.xml,"… Silicon Valley tech giants, and are not publicly accountable. The chapter ends with
an exploration of anti-refugee groups in both countries, and their use of social media
platforms to spread hate and circulate conspiracy theories.
",,"K Forkert, F Oliveri, G Bhattacharyya… - How media and …, 2020 - manchesterhive.com",,
Anti-EU disinformation in the Italian and Romanian social-media,http://www.historica-cluj.ro/suplimente/SuplimentHistorica2020_2/111_Dragomir.pdf,"… Karl Popper supports clarifies further the conspiracy theories as “an explanation of a social
phenomenon through the discovery of the group which … 5.3.2 Eco-chambers and filter-bubbles
The social-media expansion has led to the polarisation of debate and the tribalisation of … 
",http://www.historica-cluj.ro/suplimente/SuplimentHistorica2020_2/111_Dragomir.pdf,"S Dragomir - Anuarul Institutului de Istorie» George Bariţiu «-Series …, 2020 - ceeol.com",,All 2 versions
[PDF][PDF] Digital Disinformation Is a Threat to Public Health,https://lernercenter.syr.edu/wp-content/uploads/2020/07/Brown_HealthDisinformation_FInal.pdf,"… Verso Books. 5. Zhuravskaya, E., Petrova, M., & Enikolopov, R. (2020). Political effects of the
internet and social media. Annual Review of Economics, 12. 6. Andrade, G. (2020). Medical
conspiracy theories: Cognitive science and implications for ethics … 
",https://lernercenter.syr.edu/wp-content/uploads/2020/07/Brown_HealthDisinformation_FInal.pdf,AMN Brown - 2020 - lernercenter.syr.edu,,All 2 versions
Going viral: How a single tweet spawned a COVID-19 conspiracy theory on Twitter,https://philpapers.org/rec/MAIGVH,"… The Impact of Social Media on Panic During the COVID-19 Pandemic in Iraqi Kurdistan: Online
Questionnaire Study.Araz Ramazan Ahmad & Hersh Rasool Murad - 2020 - Journal of Medical
Internet Research 22 (5):e19556. Conspiracy Theories.Marc Pauly - 2020 - Internet … 
",,"P Mai, A Gruzd - 2020 - philpapers.org",,
Viral lesbians: geopolitical uses of digital meme worship and sharing,https://anz-covid19-portal.elsevierpure.com/en/publications/viral-lesbians-geopolitical-uses-of-digital-meme-worship-and-shar,"… global orders for cyberwar related functions. Viruses are being anthropomorphised—
attributed human-like forms and traits—to spread geopolitical conspiracy theories
on social media. As is often the case, highly sexualised … 
",,"T Jones - … 4.1: Australian LGBTIQA+ art, writing & …, 2020 - anz-covid19-portal.elsevierpure.com",,All 2 versions
[HTML][HTML] Post-'refugee crisis' social media: the unbearable lightness of sharing racist posts,https://discoversociety.org/2020/09/02/post-refugee-crisis-social-media-the-unbearable-lightness-of-sharing-racist-posts/,"… while it is empowering that users can start anonymous profiles, especially in authoritarian contexts
where users' social media posts are overseen and penalised by states, anonymous accounts
also facilitate the spread of various forms of hate, conspiracy theories as well as fake … 
",,"O Ozduzen, U Korkut - 2020 - discoversociety.org",,All 2 versions
"[PDF][PDF] Messing with the Enemy: Surviving in a Social Media World of Hackers, Terrorists, Russians, and Fake News",https://digital-commons.usnwc.edu/cgi/viewcontent.cgi?article=8105&context=nwc-review,"… not mess so personally with the Kremlin, but he was among the earliest voices warning of Russian
social-media-influence operations … United States after the occupation of Crimea in 2014 
Russia-linked sources promoted all manner of conspiracy theories, extremist ideologies … 
",https://digital-commons.usnwc.edu/cgi/viewcontent.cgi?article=8105&context=nwc-review,"DT Burbach, C Watts - Naval War College Review, 2020 - digital-commons.usnwc.edu",,All 3 versions
"Too famous to protest: Far-right online community bonding over collective desecration of Colin Kaepernick, fame, and celebrity activism",https://journals.sagepub.com/doi/abs/10.1177/0196859920911650,"… Share this article via social media. The e-mail addresses that you supply to use this
service will not be used for any other purpose without your consent. Recommend
to a friend. Email a link to the following content: *Recipient's … 
",,"SS Duvall - Journal of Communication Inquiry, 2020 - journals.sagepub.com",Cited by 2,All 2 versions
Factions: acts of worldbuilding on social media platforms,http://theses.gla.ac.uk/81994/9/2020LittleDFA.pdf,"… (Dings 2017) Exhibit C—Conspiracy theories via a collision of intentionally manipulated deep
fakes. Exhibit D—Artfully presented nonfiction that intentionally uses techniques of … media. I
wanted to use the more mature and established social media platforms … 
",http://theses.gla.ac.uk/81994/9/2020LittleDFA.pdf,DL Little - 2020 - theses.gla.ac.uk,,All 3 versions
"A Dialectic of Conspiracy: The Conspiracy of Capital: Law, Violence, and American Popular Radicalism in the Age of Monopoly. Amherst: University of Massachusetts …",https://search.proquest.com/openview/49dd62f111c6f5f7a57cffd78ae44ef8/1?pq-origsite=gscholar&cbl=616516,"… of the American Federation of Labor's steel erectors union, partly because it pro- voked an
avalanche of popular conspiracy theories implicating an … boom radicalism during the “Age of
Monopoly,” Cohen does not believe it works the same way in our current age of social media … 
",,"T Messer-Kruse - The Journal of the Gilded Age and …, 2020 - search.proquest.com",,All 2 versions
The issues raised by data gathering on Twitter due to the opacity of its moderation,https://hal.archives-ouvertes.fr/hal-02981162/,"… users are not the only ones to express hatred, to share fake news, conspiracy theories, to spread
misinformation or desinformation. Politicians and polemicists are also arousing the fears around
migration for electoral or economic purposes. In this context, social media are used … 
",,"M Tomaszewski - Matinée d'étude sur les corpus issus des …, 2020 - hal.archives-ouvertes.fr",,All 3 versions
Belief in COVID-19 Conspiracy Theories and Its Correlates,https://osf.io/kp8md/?view_onlyc63a0efd1443da8fa82399e388f3d,"… We will disseminate the link for the online survey on social media … We investigate how belief in
COVID-19 conspiracy theories relates to prevention behaviors, as well as related individual
differences, including cognitive reflection, faith in intuition, uncertainty avoidance, risk … 
",,"S Alper, O Yilmaz, F Bayrak - 2020 - osf.io",,
"How Do People Process and Share Fake News on Social Media? On the Context of Dual-Process of Credibility with Partisanship, Cognitive Appraisal to Threat, and …",https://search.proquest.com/openview/91ce7679f1885c45fb5f59ddb6d84403/1?pq-origsite=gscholar&cbl=18750&diss=y,"… (2017), fake news relates to the articles that are created and advertised on social media to deceive
newsreaders in order to gain ideological or financial benefits … particular news articles. Third,
conspiracy theories. Fourth, a satire that is unlikely to be misconstrued as factual … 
",,SJ Kim - 2020 - search.proquest.com,,
"Mental shortcuts, emotion, and social rewards: the challenges of detecting and resisting fake news",https://books.google.com/books?hl=en&lr=&id=1WPMDwAAQBAJ&oi=fnd&pg=PA223&dq=%22social+media%22+AND+%22conspiracy+theories%22&ots=TMEwxG2JHP&sig=RnGa-HgmQO5xULlgZE8Hud6m7z0,"… One such heuristic relevant to social media is social endorsement, or the extent to which we think
other people are supporting and sharing the … 16 Precisely because fake news, urban legends,
and conspiracy theories are more novel than the run-of-the-mill truth, users are driven … 
",,"ND Bowman, E Cohen - … Media and Misinformation in the Digital …, 2020 - books.google.com",Cited by 5,All 2 versions
On the Misinformation Beat: Understanding the Work of Investigative Journalists Reporting on Problematic Information Online,https://dl.acm.org/doi/abs/10.1145/3415204,"… have facilitated harassment [54, 90], election interference [22], and the spread of conspiracy
theories during an epidemic [62]. Journalists, too, are increasingly reporting on problematic
information in online environments. Experienced internet, social media, and national security … 
",,"M McClure Haughey, MD Muralikumar… - Proceedings of the …, 2020 - dl.acm.org",,
[BOOK][B] Netnography Unlimited: Understanding Technoculture Using Qualitative Social Media Research,https://books.google.com/books?hl=en&lr=&id=TMYKEAAAQBAJ&oi=fnd&pg=PT13&dq=%22social+media%22+AND+%22conspiracy+theories%22&ots=OO8qKCdW8B&sig=vl8HjBFJ1j9DcbJTczlOyF4rfSI,"… As a final example, consider the social media discussion of the Ebola outbreak I write about in
Kozinets (2015, 208–218). At the time, I noted the tensions around forced quarantines, the blaming
of foreign governments, the conspiracy theories about its creation in secret … 
",,"RV Kozinets, R Gambetti - 2020 - books.google.com",,All 3 versions
Social media-a two-edge sword in political campaign: the case of the Republic of Moldova,http://ejournals.facultas.at/index.php/ocgcp/article/download/1902/1616,"… information, which includes, but is not limited to lies, fake news, conspiracy theories, and rumours
to change electorate cognition or beliefs. This dark current of people who equate free speech
with the right to say anything, even hate speech, find on social media platforms a … 
",http://ejournals.facultas.at/index.php/ocgcp/article/download/1902/1616,"II Vîrtosu - Central and Eastern European eDem and eGov …, 2020 - ejournals.facultas.at",,All 7 versions
[HTML][HTML] Quarantining online hate speech: technical and ethical perspectives,https://link.springer.com/article/10.1007%252Fs10676-019-09516-z,"… In recent years, it has provided a powerful platform for those who have sought to spread conspiracy
theories (eg anti-vaccine), extremist views … The various systems developed so far frequently adopt
a binary classification framework: given a social media post P (eg, a tweet), the … 
",,"S Ullmann, M Tomalin - Ethics and Information Technology, 2020 - Springer",Cited by 19,All 9 versions
[PDF][PDF] Conspiracy Theories in Russian Security Thinking,https://www.martinkragh.com/s/Conspiracy-Theories_JSS_pre-print.pdf,"… of conspiracy theories in Russian domestic political discourse, and in public diplomacy tools
such as RT, Russia's international broadcaster.19 The spread of disinformation, including the
use of so-called troll factories to influence public opinion through social media and the … 
",https://www.martinkragh.com/s/Conspiracy-Theories_JSS_pre-print.pdf,"E Andermo, M Kragh, L Makashova - martinkragh.com",,
Platforms and Potency: Democracy and Collective Agency in the Age of Social Media,https://repository.uel.ac.uk/download/6ec6b96cd102ab452604fbcdd19fcc76bb026aac3ac451097ecef797ac4ed416/318618/%5B24513474%20-%20Open%20Cultural%20Studies%5D%20Platforms%20and%20Potency%20Democracy%20and%20Collective%20Agency%20in%20the%20Age%20of%20Social%20Media.pdf,"… If we further consider, for example, the recent proliferation of obfuscatory conspiracy theories via
social media (Rosenberg and Steinhauer), it is clear that platform media have an extraordinary
capacity to render populations and individuals collectively unable to effect … 
",https://repository.uel.ac.uk/download/6ec6b96cd102ab452604fbcdd19fcc76bb026aac3ac451097ecef797ac4ed416/318618/%5B24513474%20-%20Open%20Cultural%20Studies%5D%20Platforms%20and%20Potency%20Democracy%20and%20Collective%20Agency%20in%20the%20Age%20of%20Social%20Media.pdf,"J Gilbert - Open Cultural Studies, 2020 - repository.uel.ac.uk",,
Emotions and war on YouTube: affective investments in RT's visual narratives of the conflict in Syria,https://www.researchgate.net/profile/Rhys_Crilley2/publication/339919970_Emotions_and_war_on_YouTube_affective_investments_in_RT%27s_visual_narratives_of_the_conflict_in_Syria/links/5e8ca0f7a6fdcca789fdc8ba/Emotions-and-war-on-YouTube-affective-investments-in-RTs-visual-narratives-of-the-conflict-in-Syria.pdf,"… The results of our social media analysis demonstrate that RT's YouTube audiences were affectively
invested in RT's visual narratives of the … Middle East; respect and gratitude for Russia and Putin;
distrust of 'Western' institutions and openness to conspiracy theories; and finally … 
",https://www.researchgate.net/profile/Rhys_Crilley2/publication/339919970_Emotions_and_war_on_YouTube_affective_investments_in_RT%27s_visual_narratives_of_the_conflict_in_Syria/links/5e8ca0f7a6fdcca789fdc8ba/Emotions-and-war-on-YouTube-affective-investments-in-RTs-visual-narratives-of-the-conflict-in-Syria.pdf,"R Crilley, PN Chatterje-Doody - Cambridge review of international …, 2020 - Taylor & Francis",Cited by 7,All 5 versions
[PDF][PDF] COVIDLIES: Detecting COVID-19 Misinformation on Social Media,https://openreview.net/pdf/7618d81eecd5c1ac3272669330fa89c78fc9a738.pdf,"… spread of misinformation such as, ru- mors, hoaxes, fake news, propaganda, spear phish- ing,
and conspiracy theories, is an important task for natural language processing (Thorne et al., 2017;
Shu et al., 2017; Thorne and Vlachos, 2018). Online social media networks provide … 
",https://openreview.net/pdf/7618d81eecd5c1ac3272669330fa89c78fc9a738.pdf,"T Hossain, RL Logan IV, A Ugarte… - Proceedings of the …, 2020 - openreview.net",Cited by 6,All 2 versions
COVID-19: Behind the rise of conspiracy theories,https://search.informit.org/doi/pdf/10.3316/informit.253315262881681,"… While social media and trump have played a role in popularising such theories, their recent
dramatic rise is not due to well-funded campaigns to undermine the … that is, conspiracy theories
reflect, rather than create, an existing deep-seated distrust in the existing state of affairs … 
",,"F Fuentes - Green Left Weekly, 2020 - search.informit.org",,All 2 versions
Regulating misinformation: policy brief,https://eprints.qut.edu.au/209083/,"… This is especially relevant during the COVID-19 pandemic, where inaccurate information
has circulated through social media, countering public health messaging and engaging
in conspiracy theories about the origins and severity of the disease … 
",,"J Meese, E Hurcombe - 2020 - eprints.qut.edu.au",,
