titre,lien,citation,pdflink,auteurEditeur,cite,version
Does fake news lead to more engaging effects on social media? Evidence from Romania,https://www.degruyter.com/view/journals/comm/45/s1/article-p694.xml,"… Press Releases; Useful Downloads; Blogs, News and Social Media. Publisher Partner
Program; Meet us; Walter de Gruyter Foundation. English; … Blogs, News and Social Media.
Publisher Partner Program; Meet us; Walter de Gruyter Foundation.
",,"N Corbu, A Bârgăoanu, R Buturoiu, O Ștefăniță - Communications, 2020 - degruyter.com",Cited by 1,All 2 versions
Antisemitic conspiracy fantasy in the age of digital media: Three 'conspiracy theorists' and their YouTube audiences,https://journals.sagepub.com/doi/pdf/10.1177/0963947020971997,"… Share this article via social media. The e-mail addresses that you supply to use this
service will not be used for any other purpose without your consent. Recommend
to a friend. Email a link to the following content: *Recipient's … 
",https://journals.sagepub.com/doi/pdf/10.1177/0963947020971997,"D Allington, BL Buarque… - Language and …, 2020 - journals.sagepub.com",Cited by 1,All 3 versions
[PDF][PDF] The pandemic of social media panic travels faster than the COVID-19 outbreak,https://covid-19.conacyt.mx/jspui/bitstream/1000/5564/1/1109386.pdf,"… rumours and conspiracy theories about the origin circulated the globe paired with
fearmongering, racism and mass purchase of face masks, all closely linked to the new
“infomedia” ecosystems of the 21st century marked by social media. A striking … 
",https://covid-19.conacyt.mx/jspui/bitstream/1000/5564/1/1109386.pdf,"D Anneliese, M Sam, K Emilie… - https://www. ncbi …, 2020 - covid-19.conacyt.mx",,
Post-Truth as Ethical Crisis with the Misuse of Social Media,https://www.cambridge.org/engage/coe/article-details/5f804ce0136add00199dda94,"… Social media has accused of misusing secret information during American presidential election
in 2016 including Russian trolls organizing events attended by thousands of unaware American
citizens; Turkish pro-government activists amplifying on Twitter conspiracy theories … 
",,M Neupane - 2020 - cambridge.org,,
"COVID-19 Stress and Depression: Examining Social Media, Traditional Media, and Interpersonal Communication",https://www.tandfonline.com/doi/abs/10.1080/15325024.2020.1835386,"… Early research on the COVID-19 pandemic has found that among adults in China, more exposure
to social media coverage of … Moreover, the flood of information available during an infodemic
facilitates the spreading of misinformation and conspiracy theories (Zarocostas, 2020) … 
",,"JM First, H Shin, YS Ranjit… - Journal of Loss and …, 2020 - Taylor & Francis",Cited by 5,
"[HTML][HTML] A call to arms: helping family, friends and communities navigate the COVID-19 infodemic",https://www.nature.com/articles/s41577-020-0380-8,"… social media monitoring team at The Vaccine Confidence Project captured more than 698 million
digital and social media messages globally … and concerns among the public, we are hearing the
spectrum of conversations from potentially harmful conspiracy theories to genuine … 
",,"HJ Larson - Nature Reviews Immunology, 2020 - nature.com",Cited by 22,All 9 versions
[PDF][PDF] How the pandemic defeated America,https://www.mfprac.com/web2020/07literature/literature/Infectious_Dis/Covid19-DefeatedNation_Yong.pdf,"… When COVID-19 arrived, “there was no doubt in my mind that it {fake news spread
by social media} was coming.” Sure enough, existing conspiracy theories— George
Soros! 5G! Bioweapons!—were repurposed for the pandemic … 
",https://www.mfprac.com/web2020/07literature/literature/Infectious_Dis/Covid19-DefeatedNation_Yong.pdf,"E Yong - The Atlantic, 2020 - mfprac.com",Cited by 27,
[HTML][HTML] Pandemics & propaganda: how Chinese state media creates and propagates CCP coronavirus narratives,https://misinforeview.hks.harvard.edu/article/pandemics-propaganda-how-chinese-state-media-creates-and-propagates-ccp-coronavirus-narratives/,"… narratives in a way favorable to the Chinese government, engaging in revisionist history, and
paying social media platforms to … The COVID-19 content evolved, moving beyond generic positive
spin into misleadingly reframed events, and amplification of conspiracy theories … 
",,"V Molter, R DiResta - Harvard Kennedy School …, 2020 - misinforeview.hks.harvard.edu",Cited by 6,
[PDF][PDF] Vaccine movements on social media,https://uwe-repository.worktribe.com/preview/6941546/REDACTED%20Thesis%20-%20Final%20approved%20version.pdf,"… Anti- vaccine activists disseminate and sensationalise objections to vaccinations through
various channels, including the internet and social media outlets, such as Twitter … and
promoted vaccine conspiracy theories. They also provided alternative … 
",https://uwe-repository.worktribe.com/preview/6941546/REDACTED%20Thesis%20-%20Final%20approved%20version.pdf,E Milani - 2020 - uwe-repository.worktribe.com,,All 2 versions
[PDF][PDF] Facebook executives shut down efforts to make the site less divisive,https://www.digitalanarchy.com/da_stuff/Facebook.pdf,"… acute, as a charged presidential election looms and Facebook has been a conduit for conspiracy
theories and partisan sparring about the coronavirus pandemic. TECH Facebook Executives
Shut Down Efforts to Make the Site Less Divisive The social-media giant internally … 
",https://www.digitalanarchy.com/da_stuff/Facebook.pdf,"J Horwitz, D Seetharaman - The Wall Street Journal, 2020 - digitalanarchy.com",Cited by 26,
"Threat perceptions of COVID-19 pandemic: News discernment, media exaggeration, and misleading information",https://www.ceeol.com/search/article-detail?id=913042,"… because of the excess of inaccuracy. (Rosenberg et al., 2020) Escalated debates
across online platforms encompass COVID-19 conspiracy theories distributed by
social media users. (Ahmed et al., 2020) Mainstream media … 
",,"S Bratu - Analysis and Metaphysics, 2020 - ceeol.com",Cited by 1,All 7 versions
"[PDF][PDF] Types, sources, and claims of COVID-19 misinformation",http://www.primaonline.it/wp-content/uploads/2020/04/COVID-19_reuters.pdf,"… 35% 40% 45% public authority action community spread general medical prominent actors
conspiracy theories how virus transmits virus origins … Several of the major social media platform
companies have taken steps to try to limit the spread of misinformation about COVID-19 … 
",http://www.primaonline.it/wp-content/uploads/2020/04/COVID-19_reuters.pdf,"JS Brennen, F Simon, PN Howard, RK Nielsen - Reuters Institute, 2020 - primaonline.it",Cited by 236,All 9 versions
What types of covid-19 conspiracies are populated by twitter bots?,https://journals.uic.edu/ojs/index.php/fm/article/download/10633/9548,"… S. Shahsavari, P. Holur, TR Tangherlini, and V. Roychowdhury, 2020. “Conspiracy in the time
of corona: Automatic detection of Covid-19 conspiracy theories in social media and the news,”
arXiv, 2004.13783 (28 April), at http://arxiv.org/abs/2004.13783, accessed 18 May 2020 … 
",,"E Ferrara - First Monday, 2020 - journals.uic.edu",Cited by 64,All 5 versions
The effect of web add-on correction and narrative correction on belief in misinformation depending on motivations for using social media,https://www.tandfonline.com/doi/abs/10.1080/0144929X.2020.1829708,"… The effect of web add-on correction and narrative correction on belief in misinformation depending
on motivations for using social media … The effect of web add-on correction and narrative correction
on belief in misinformation depending on motivations for using social media … 
",,"J Lee - Behaviour & Information Technology, 2020 - Taylor & Francis",Cited by 1,
[PDF][PDF] COVID-19 Conspiracy Beliefs among Students in China and Germany–Causes and Effects,https://www.uni-trier.de/fileadmin/fb4/prof/BWL/FIN/Files/conpiracies3.pdf,"… dence,5 so it seems unlikely that such statements are actively censored.6 The origins of the
propaganda of anti-US conspiracy theories on social media are unclear. Its amount, however,
was huge, especially on the Chinese social media network WeChat … 
",https://www.uni-trier.de/fileadmin/fb4/prof/BWL/FIN/Files/conpiracies3.pdf,MO Rieger - 2020 - uni-trier.de,Cited by 2,
Hero or villain? Responses to Greta Thunberg's activism and the implications for travel and tourism,https://www.tandfonline.com/doi/pdf/10.1080/09669582.2020.1789157,"… was deemed appropriate as the data source, as it allows for more extensive posts compared
to other social media sites, such … For example, in Schmitt's (2019) characterisation, 'conspiracy
theories' are not mentioned; the category was created after it emerged in the current data … 
",https://www.tandfonline.com/doi/pdf/10.1080/09669582.2020.1789157,"M Mkono, K Hughes, S Echentille - Journal of Sustainable Tourism, 2020 - Taylor & Francis",Cited by 10,All 4 versions
"[BOOK][B] Cyberwar: how Russian hackers and trolls helped elect a president: what we don't, can't, and do know",https://books.google.com/books?hl=en&lr=&id=S2DxDwAAQBAJ&oi=fnd&pg=PP1&dq=%22social+media%22+AND+%22conspiracy+theories%22&ots=FSfgsCxxeU&sig=LrVLjsJKtlUYY6pFJQMbNrCsYGE,"… Where the first edition limited its scope to accounting for the electoral outcome, Cyberwar 2.0
also pulls together evidence about Russian plans to delegitimize Hillary Clinton's anticipated
presidency with a social media campaign they tagged #DemocracyRIP … 
",,KH Jamieson - 2020 - books.google.com,Cited by 196,All 2 versions
A first look at COVID-19 information and misinformation sharing on Twitter,https://arxiv.org/pdf/2003.13907,"… We initially identified ten myths ranging from home remedies to conspiracy theories about the
origin of the virus to misinformation about warm weather killing the virus. To understand how
certain myths about COVID-19 gained traction on social media, we searched for each of … 
",https://arxiv.org/pdf/2003.13907,"L Singh, S Bansal, L Bode, C Budak, G Chi… - arXiv preprint arXiv …, 2020 - arxiv.org",Cited by 89,All 8 versions
NLP-based feature extraction for the detection of COVID-19 misinformation videos on Youtube,https://www.aclweb.org/anthology/2020.nlpcovid19-acl.17.pdf,"… The limited knowledge on the na- ture and origin of the virus gave ample space for the emergence
of conspiracy theories, which were … User comment data has been employed to annotate social
media objects (Momeni et al., 2013), infer the political leaning of news articles (Park … 
",https://www.aclweb.org/anthology/2020.nlpcovid19-acl.17.pdf,"JCM Serrano, O Papakyriakopoulos… - … on NLP for COVID-19 at …, 2020 - aclweb.org",Cited by 12,All 3 versions
Social Media and the Institutionalization of Hate Speech in Greek Politics,https://brill.com/view/book/9789004439559/BP000003.xml,"Jump to Content Jump to Main Navigation. English; 中文; français; Deutsch. Access
via: Google Googlebot - Web Crawler SEO. Login to my Brill account Create Brill
Account. Publications. Subjects. African Studies American Studies … 
",,"V Vamvakas - Crisis' Representations: Frontiers and Identities in the …, 2020 - brill.com",,All 2 versions
[HTML][HTML] The need for a mental health technology revolution in the COVID-19 pandemic,https://www.ncbi.nlm.nih.gov/pmc/articles/PMC7283500/,"… Large social media platforms are now reportedly taking steps to remove false content or
conspiracy theories about the pandemic, using artificial intelligence (AI); and distribute reliable
information, such as developed by the World Health Organization (31) … 
",,"CA Figueroa, A Aguilera - Frontiers in Psychiatry, 2020 - ncbi.nlm.nih.gov",Cited by 28,All 6 versions
[PDF][PDF] The Digital Challenges to Democracy: Social Media and New Information Paradigms,http://web2py.iiit.ac.in/research_centres/publications/download/mastersthesis.pdf.a25a4b7c707929d3.4d535468657369735f32303135353031355f46696e616c2e706466.pdf,"Page 1. The Digital Challenges to Democracy: Social Media and New Information Paradigms …
v Page 6. Abstract The social and political shifts being perpetuated by the Internet and social
media are dominating contemporary discourse around politics, society and technology … 
",http://web2py.iiit.ac.in/research_centres/publications/download/mastersthesis.pdf.a25a4b7c707929d3.4d535468657369735f32303135353031355f46696e616c2e706466.pdf,N Agrawal - 2020 - web2py.iiit.ac.in,,
"Online Polarization, Radicalization, and Conspiracy",https://books.google.com/books?hl=en&lr=&id=lB4EEAAAQBAJ&oi=fnd&pg=PA151&dq=%22social+media%22+AND+%22conspiracy+theories%22&ots=zgaFIRUXuP&sig=KwtafDPKHCNo6f0IQdsQ0koYhvs,"… The use of the OK-sign as a symbol of the far right, referring to conspiracy theories such as QAnon,
and spreading them … As Balca Arda wrote “(... an Internet meme becomes a performative show
that is collaboratively created on social media through the desire for participation … 
",,"P Jääskeläinen, AM Huhtinen - ECCWS 2020 20th European …, 2020 - books.google.com",,All 2 versions
"Twilight of democracy: the seductive lure of authoritarianism: Anne Applebaum, New York, Doubleday, 2020, 224 pp., 25.00(hardback),ISBN:9780385545808, 27.00 …",https://rsa.tandfonline.com/doi/pdf/10.1080/15387216.2020.1831940,"… Such conspiracy theories establish the presence of external or internal enemies intent at
sabotaging the nation; their constant rehearsal, their uncontrolled spread through social media,
and the increasing tendency among authoritarian leaders to verbally break the taboo … 
",,M Gentile - 2020 - rsa.tandfonline.com,,All 2 versions
What is actually true? Approaches to teaching conspiracy theories and alternative narratives in history lessons,https://journals.uio.no/adnorden/article/download/8377/7355,"… propaganda, hoaxes and fake news are all undeniably on the rise, in part because of the
proliferation of digital and social media (Hobbs, 2017; Brockhoff, Peters, & Thorup, 2018).
Inevitably, some people end up believing in fake news and conspiracy theories, and research … 
",https://journals.uio.no/adnorden/article/download/8377/7355,"RA Peters, HJ Johannesen - Acta Didactica Norden, 2020 - journals.uio.no",,All 2 versions
[PDF][PDF] Demographics and conspiracy theories,https://www.academia.edu/download/62976343/Smallpage__Drochon__Uscinski_and_Klofstad-Who_are_the_conspiracy_theorists_Demographics_and_conspiracy_theories20200416-26211-r34m6c.pdf,"… theorists? Demographics and conspiracy theories Steven M. Smallpage, Hugo Drochon, Joseph
E. Uscinski and Casey Klofstad Introduction … We provide the only cross- nationally-representative
data focusing on conspiracy theories currently available (Drochon 2018) … 
",https://www.academia.edu/download/62976343/Smallpage__Drochon__Uscinski_and_Klofstad-Who_are_the_conspiracy_theorists_Demographics_and_conspiracy_theories20200416-26211-r34m6c.pdf,"SM Smallpage, H Drochon, JE Uscinski, C Klofstad - 2020 - academia.edu",,
"Breast Cancer Prevention and Treatment: Misinformation on Pinterest, 2018",https://ajph.aphapublications.org/doi/pdf/10.2105/AJPH.2020.305812?download=true,"… moderators should be rather expansive in what sort of pins they consider evaluating for
misinformation; obvious flags like conspiracy theories may not … First, studies suggest that false
and misleading health stories get far more shares on social media than do verified news stories … 
",https://ajph.aphapublications.org/doi/pdf/10.2105/AJPH.2020.305812?download=true,"T Wilner, A Holton - American Journal of Public Health, 2020 - ajph.aphapublications.org",,All 6 versions
[PDF][PDF] How Social Media Stole an Election,https://www.researchgate.net/profile/Sophia_Porotsky/publication/343862544_Sophia_Porotsky_Cyber_Warfare_Paper/links/5f4559e1a6fdcccc4302b497/Sophia-Porotsky-Cyber-Warfare-Paper.pdf,"… social media. It becomes apparent that when all elements are considered together, there
is a substantial argument to be made that social media was used … volumes, when they know
he's online, and they push conspiracy theories'…Watts flatly stated … 
",https://www.researchgate.net/profile/Sophia_Porotsky/publication/343862544_Sophia_Porotsky_Cyber_Warfare_Paper/links/5f4559e1a6fdcccc4302b497/Sophia-Porotsky-Cyber-Warfare-Paper.pdf,S Porotsky - An Examination of the Bilateral Assault on the … - researchgate.net,Cited by 1,All 2 versions
The effects of thinking styles and news domain on fake news recognition by social media users: Evidence from Russia,https://scila.hse.ru/data/2020/06/02/1603987627/Porshnev%20Miltsov%20HCI2020.pdf,"… as the ability to solve logical problems) and magical thinking (associated with beliefs in the
extraordinary [8]). The belief in conspiracy theories and the … 2] or with the degree of trust in a
particular media outlet [8]. Even though, given the fact that on social media platforms, a news … 
",https://scila.hse.ru/data/2020/06/02/1603987627/Porshnev%20Miltsov%20HCI2020.pdf,"A Porshnev, A Miltsov - International Conference on Human-Computer …, 2020 - Springer",,All 4 versions
Irrational beliefs differentially predict adherence to guidelines and pseudoscientific practices during the COVID‐19 pandemic,https://www.ncbi.nlm.nih.gov/pmc/articles/PMC7753549/,"… through social media (Depoux et al., 2020; Kouzy et al., 2020; Mian & Khan, 2020; Zarocostas,
2020) may also have the potential to substantially impact health outcomes. Some of the promising
interventions to counter science misinformation and conspiracy theories include … 
",,"P Teovanović, P Lukić, Z Zupan, A Lazić… - Applied Cognitive …, 2020 - Wiley Online Library",Cited by 20,All 8 versions
"[HTML][HTML] COVID‐19: Emerging compassion, courage and resilience in the face of misinformation and adversity",https://www.ncbi.nlm.nih.gov/pmc/articles/pmc7166833/,"… levels of misinformation, conspiracy theories, fake news and rumours related to COVID‐19, these
can only be counterproductive in the fight against the current epidemic. Perhaps, this is the first
major disease outbreak that poses a global threat in the age of social media … 
",,"GD Smith, F Ng, WHC Li - Journal of clinical nursing, 2020 - ncbi.nlm.nih.gov",Cited by 108,All 11 versions
Facts and myths about misperceptions,https://pubs.aeaweb.org/doi/pdf/10.1257/jep.34.3.220,"… Similar incentives encourage hosts on talk radio and cable news to promote misleading claims
and conspiracy theories that engage and … costs (content creation without original reporting is
inexpensive), and low barriers to entry and distribution on social media (which puts … 
",https://pubs.aeaweb.org/doi/pdf/10.1257/jep.34.3.220,"B Nyhan - Journal of Economic Perspectives, 2020 - aeaweb.org",Cited by 11,All 9 versions
"[HTML][HTML] Infodemia, fake news and medicine: science and the quest for truth",https://www.scielo.br/scielo.php?pid=S2359-56472020005004201&script=sci_arttext,"… fraudulent article published in Lancet. 5 This misinformation was widely disseminated
on social media and, combined with conspiracy theories and other beliefs strength
an anti-vaccination movement. As a consequence, in 2020 … 
",,"CT Mesquita, A Oliveira, FL Seixas… - International Journal of …, 2020 - SciELO Brasil",Cited by 21,All 10 versions
Vaccine misinformation-topic-based content analysis on Facebook,https://academic.oup.com/eurpub/article-abstract/30/Supplement_5/ckaa166.1441/5913460,"… A relatively large amount of content concentrated in terms of conspiracy theories and
disinformation may indicate that this is a community characterized by a lack of trust in the scientific …
The tendency of vaccine-hesitancy is strengthened by 'anti-vaccine' content in social media … 
",,"K Klimiuk, K Biernacka, Ł Balwicki - European Journal of Public …, 2020 - academic.oup.com",,All 2 versions
Falling into the echo chamber: the Italian vaccination debate on Twitter,https://ojs.aaai.org/index.php/ICWSM/article/download/7285/7139/,"… 2015), conspiracy theories (Jolley and Douglas 2014), and political attitudes (Yaqub et al. 2014).
As social media – and espe- cially Twitter as a public platform – becomes increasingly important
in the expression of such attitudes, public health * After the first author, authors are … 
",https://ojs.aaai.org/index.php/ICWSM/article/download/7285/7139/,"A Cossard, GDF Morales, K Kalimeri… - … Web and Social Media, 2020 - ojs.aaai.org",Cited by 15,All 7 versions
The Truth Is Out There: The Prevalence of Conspiracy Theory Use by Radical Violent Extremist Organizations,https://www.tandfonline.com/doi/abs/10.1080/09546553.2020.1835654,"… The use of the Internet and social media sites makes the sharing of conspiracy
theories immediate and pervasive. Brenton Tarrant used online media to promote
an ideology and to justify violent actions. RVE organizations do … 
",,"GJ Rousis, FD Richard, DYD Wang - Terrorism and Political …, 2020 - Taylor & Francis",,
[HTML][HTML] Caught in the Crossfire: How Contradictory Information and Norms on Social Media Influence Young Women's Intentions to Receive HPV Vaccination in the …,https://www.ncbi.nlm.nih.gov/pmc/articles/PMC7744687/,"… Caught in the Crossfire: How Contradictory Information and Norms on Social Media Influence
Young Women's Intentions to Receive HPV Vaccination in the United States and China … Literature
Review. Exposure to Contradictory Health Information on Social Media … 
",,"S Pan, JZ Di Zhang - Frontiers in Psychology, 2020 - ncbi.nlm.nih.gov",,All 4 versions
"[HTML][HTML] Limiting the capacity for hate: Hate speech, hate groups and the philosophy of hate",https://www.tandfonline.com/doi/full/10.1080/00131857.2020.1802818,"… State education to address the issue of hate speech in order to prepare students to understand,
analyse and resist the call of hate groups but also to equip students to exercise informed judgment
about the nature of conspiracy theories circulated by social media platforms like … 
",,MA Peters - 2020 - Taylor & Francis,Cited by 2,All 2 versions
Social Media: A tool that can benefit public health?,https://journal.emwa.org/writing-for-patients/social-media-a-tool-that-can-benefit-public-health/article/7232/social-media-a-tool-that-can-benefit-public-health.pdf,"… without a prescription or a bath in bovine faecal matter, drinking toxic detergents, or otherwise
partaking in risky behaviours that could have a social negative impact, such as panic shopping
or spreading “conspiracy theories”.5 Nevertheless, social media was responsible for … 
",https://journal.emwa.org/writing-for-patients/social-media-a-tool-that-can-benefit-public-health/article/7232/social-media-a-tool-that-can-benefit-public-health.pdf,"S Ferrao - Medical Writing, 2020 - journal.emwa.org",,
[HTML][HTML] The effects of corrective information about disease epidemics and outbreaks: Evidence from Zika and yellow fever in Brazil,https://advances.sciencemag.org/content/6/5/eaaw7449?from=timeline&isappinstalled=0,"… Abstract. Disease epidemics and outbreaks often generate conspiracy theories and
misperceptions that mislead people about the risks they face and how best to protect
themselves. We investigate the effectiveness of interventions … 
",,"JM Carey, V Chi, DJ Flynn, B Nyhan… - Science …, 2020 - advances.sciencemag.org",Cited by 44,All 10 versions
"Political extremity, social media use, social support, and well-being for emerging adults during the 2016 presidential election campaign",https://osf.io/fzym7/download,"… Format, Tips on citation download. Download Citation. Download article citation data for: Political
Extremity, Social Media Use, Social Support, and Well-Being for Emerging Adults During the 2016
Presidential Election Campaign … Share this article via social media … 
",https://osf.io/fzym7/download,"DC Leighton, MJ Brandt, LA Kennedy - Emerging Adulthood, 2020 - journals.sagepub.com",Cited by 1,All 6 versions
[PDF][PDF] Belief in Conspiracy Theory about COVID-19 Predicts Mental Health and Well-being,https://www.researchgate.net/profile/Asghar-Afshar-Jahanshahi/publication/341718829_Belief_in_Conspiracy_Theory_about_COVID-19_Predicts_Mental_Health_and_Well-being_-_A_Study_of_Healthcare_Staff_in_Ecuador_Preprint/links/5ed6b7d945851529452a304a/Belief-in-Conspiracy-Theory-about-COVID-19-Predicts-Mental-Health-and-Well-being-A-Study-of-Healthcare-Staff-in-Ecuador-Preprint.pdf,"… to identify potentially mentally vulnerable people, who may browse, search, follow, like, further
discuss, or disseminate COVID-19 related conspiracy theories via social media and other
information channels. Such information can serve as a risk factor to identify individuals … 
",https://www.researchgate.net/profile/Asghar-Afshar-Jahanshahi/publication/341718829_Belief_in_Conspiracy_Theory_about_COVID-19_Predicts_Mental_Health_and_Well-being_-_A_Study_of_Healthcare_Staff_in_Ecuador_Preprint/links/5ed6b7d945851529452a304a/Belief-in-Conspiracy-Theory-about-COVID-19-Predicts-Mental-Health-and-Well-being-A-Study-of-Healthcare-Staff-in-Ecuador-Preprint.pdf,"X Chen, SX Zhang, AA Jahanshahi, A Alvarez-Risco… - researchgate.net",,
"Hypertext, Social Media, and Civic Engagement: How Hypertext is Ruining the World, and Might Just Save It",https://dl.acm.org/doi/abs/10.1145/3406853.3432660,"… But just as hyperlinked social media subverts our discourse, it also has the power to connect
us to the truth, to facts, to debunked conspiracy theories, and to a diversity of ideas. Social media
platforms have begun to flag questionable claims and hyperlink us to facts … 
",,"JO Wobbrock - Proceedings of the 3rd Workshop on Human Factors in …, 2020 - dl.acm.org",,
