titre,lien,citation,pdflink,auteurEditeur,cite,version
Conspiracy in the time of corona: Automatic detection of covid-19 conspiracy theories in social media and the news,https://arxiv.org/pdf/2004.13783,"Rumors and conspiracy theories thrive in environments of low confidence and low trust. Consequently, it is not surprising that ones related to the Covid-19 pandemic are proliferating given the lack of any authoritative scientific consensus on the virus, its spread …",https://arxiv.org/pdf/2004.13783,"S Shahsavari, P Holur, TR Tangherlini… - arXiv preprint arXiv …, 2020 - arxiv.org",Cited by 29,All 7 versions
[HTML][HTML] Conspiracy theories as barriers to controlling the spread of COVID-19 in the US,https://www.sciencedirect.com/science/article/pii/S027795362030575X,"… We hypothesized that accepting conspiracy theories that were circulating in mainstream and
social media early in the COVID-19 pandemic in the US would be negatively related to the uptake
of preventive behaviors and also of vaccination when a vaccine becomes available … 
",,"D Romer, KH Jamieson - Social Science & Medicine, 2020 - Elsevier",Cited by 46,All 11 versions
"Health-protective behaviour, social media usage and conspiracy belief during the COVID-19 public health emergency",https://www.cambridge.org/core/services/aop-cambridge-core/content/view/A0DC2C5E27936FF4D5246BD3AE8C9163/S003329172000224Xa.pdf/health-protective-behaviour-social-media-usage-and-conspiracy-belief-during-the-covid-19-public-health-emergency.pdf,"… society' by Popper (1969), and what Hofstadter termed 'conspiratorial fantasies' (1964) are now
popularly referred to as 'conspiracy theories' … latest wave in an ongoing 'del- uge of conflicting
information, misinformation and manipulated information on social media' which some … 
",https://www.cambridge.org/core/services/aop-cambridge-core/content/view/A0DC2C5E27936FF4D5246BD3AE8C9163/S003329172000224Xa.pdf/health-protective-behaviour-social-media-usage-and-conspiracy-belief-during-the-covid-19-public-health-emergency.pdf,"D Allington, B Duffy, S Wessely, N Dhavan… - Psychological …, 2020 - cambridge.org",Cited by 147,All 11 versions
[HTML][HTML] Conspiracy in the time of corona: automatic detection of emerging COVID-19 conspiracy theories in social media and the news,https://link.springer.com/article/10.1007/s42001-020-00086-5,"Rumors and conspiracy theories thrive in environments of low confidence and low trust. Consequently, it is not surprising that ones related to the COVID-19 pandemic are proliferating given the lack of scientific consensus on the virus's spread and containment, or …",,"S Shahsavari, P Holur, T Wang, TR Tangherlini… - Journal of computational …, 2020 - Springer",Cited by 9,All 16 versions
[HTML][HTML] COVID-19–related infodemic and its impact on public health: A global social media analysis,https://www.ncbi.nlm.nih.gov/pmc/articles/PMC7543839/,"… Infodemics, often including rumors, stigma, and conspiracy theories, have been common during
the COVID-19 pandemic. Monitoring social media data has been identified as the best method
for tracking rumors in real time and as a possible way to dispel misinformation and … 
",,"MS Islam, T Sarkar, SH Khan, AHM Kamal… - The American Journal …, 2020 - ncbi.nlm.nih.gov",Cited by 106,All 16 versions
Effects of vaccine-related conspiracy theories on Chinese young adults' perceptions of the HPV vaccine: An experimental study,https://www.tandfonline.com/doi/abs/10.1080/10410236.2020.1751384,"… The anti-vaccine movement has also penetrated the social media landscape. A growing
number of vaccine-related conspiracy theories have emerged and spread widely online
in the past decade (Kata, 2010). Conspiracy theories … 
",,"L Chen, Y Zhang, R Young, X Wu, G Zhu - Health communication, 2020 - Taylor & Francis",Cited by 8,All 2 versions
An exploration of how fake news is taking over social media and putting public health at risk,https://www.ncbi.nlm.nih.gov/pmc/articles/PMC7404621/,"… The study concludes that the COVID‐19 infodemic is full of false claims, half backed conspiracy
theories and pseudoscientific therapies, regarding the diagnosis, treatment, prevention, origin
and spread of the virus. Fake news is pervasive in social media, putting public health at … 
",,"SB Naeem, R Bhatti, A Khan - Health Information & Libraries …, 2020 - Wiley Online Library",Cited by 27,All 7 versions
A geospatial infodemic: Mapping Twitter conspiracy theories of COVID-19,https://journals.sagepub.com/doi/abs/10.1177/2043820620935683,"… Download Citation. Download article citation data for: A geospatial infodemic: Mapping Twitter
conspiracy theories of COVID-19. Monica Stephens. Dialogues in Human Geography 0
10.1177/2043820620935683. Share. Share … Share this article via social media … 
",,"M Stephens - Dialogues in Human Geography, 2020 - journals.sagepub.com",Cited by 10,
[PDF][PDF] The spread of COVID-19 conspiracy theories on social media and the effect of content moderation,https://pdfs.semanticscholar.org/9cbb/e218ed66f13cb9c588351b99cc4ab7f5015b.pdf,"We investigate the diffusion of conspiracy theories related to the origin of COVID-19 on social media. By analyzing third-party content on four social media platforms, we show that:(a) In contrast to conventional wisdom, mainstream sources contribute overall more to …",https://pdfs.semanticscholar.org/9cbb/e218ed66f13cb9c588351b99cc4ab7f5015b.pdf,"O Papakyriakopoulos… - The Harvard …, 2020 - pdfs.semanticscholar.org",Cited by 10,All 4 versions
"[PDF][PDF] Covid-19 News and Information from State-Backed Outlets Targeting French, German and Spanish-Speaking Social Media Users",https://comprop.oii.ox.ac.uk/wp-content/uploads/sites/93/2020/06/Covid-19-Misinfo-Targeting-French-German-and-Spanish-Social-Media-Users.pdf,"… media outlets on social media varies by language and source country, for example: o Russian
outlets working in French and German consistently emphasized weak democratic institutions
and civil disorder in Europe, but offered different kinds of conspiracy theories about the … 
",https://comprop.oii.ox.ac.uk/wp-content/uploads/sites/93/2020/06/Covid-19-Misinfo-Targeting-French-German-and-Spanish-Social-Media-Users.pdf,"K Rebello, C Schwieter, M Schliebs… - … , Oxford, UK, Data …, 2020 - comprop.oii.ox.ac.uk",Cited by 14,All 2 versions
"Mislabeled, fragmented, and conspiracy-driven: a content analysis of the social media discourse about the HPV vaccine in China",https://www.tandfonline.com/doi/abs/10.1080/01292986.2020.1817113,"… Conspiracy theories may have permeated the social media discourse about the HPV
vaccine in China because it is a vaccine newly introduced and people are unfamiliar
with it. We explored the conspiracy-related themes that … 
",,"L Chen, Q Ling, T Cao, K Han - Asian Journal of Communication, 2020 - Taylor & Francis",Cited by 1,All 2 versions
A Longitudinal Analysis of YouTube's Promotion of Conspiracy Videos,https://arxiv.org/pdf/2003.03318,"… Marc Faddoul1, Guillaume Chaslot3, and Hany Farid1,2 Abstract Conspiracy theories have
flourished on social media, raising concerns that such content is fueling the spread of
disinformation, supporting extremist ideologies, and in some cases, leading to violence … 
",https://arxiv.org/pdf/2003.03318,"M Faddoul, G Chaslot, H Farid - arXiv preprint arXiv:2003.03318, 2020 - arxiv.org",Cited by 18,All 3 versions
[PDF][PDF] The relationship between conspiracy beliefs and compliance with public health guidance with regard to COVID-19,https://core.ac.uk/download/pdf/322486467.pdf,"… References Dunn, AG, Surian, D., Leask, J., Dey, A., Mandl, KD., and Coiera, E. 2017. Mapping
information exposure on social media to explain differences in HPV vaccine coverage in the United
States. Vaccine, 35: 3033–40. Goertzel, T. 2010. Conspiracy theories in science … 
",https://core.ac.uk/download/pdf/322486467.pdf,"D Allington, N Dhavan - Preso da: https://kclpure. kcl. ac. uk/portal/files …, 2020 - core.ac.uk",Cited by 23,All 3 versions
Conspiracy theories and their societal effects during the COVID-19 pandemic,https://journals.sagepub.com/doi/abs/10.1177/19485506211000217,"During COVID-19, conspiracy theories were intensely discussed in the media.
Generally, both believing in conspiracy theories (ie, explanations for events
based on powerholders' secret arrangement...
",,"L Pummerer, R Böhm, L Lilleholt… - Social …, 2020 - journals.sagepub.com",Cited by 8,
"[HTML][HTML] An automated pipeline for the discovery of conspiracy and conspiracy theory narrative frameworks: Bridgegate, Pizzagate and storytelling on the web",https://journals.plos.org/plosone/article?id=10.1371/journal.pone.0233879,"Although a great deal of attention has been paid to how conspiracy theories circulate on social
media, and the deleterious effect that they, and their factual counterpart conspiracies, have on
political institutions, there has been little computational work done on describing their … 
",,"TR Tangherlini, S Shahsavari, B Shahbazi… - PloS one, 2020 - journals.plos.org",Cited by 15,All 15 versions
Health disinformation & social media: The crucial role of information hygiene in mitigating conspiracy theory and infodemics,https://www.embopress.org/doi/pdf/10.15252/embr.202051819,"… to COVID‐19 conspiracy theories and 5G scaremongering. But it is hard to interpret this as
anything more than shallow lip‐service, as dangerous disinformation remains dominant across
these channels. The most charitable interpretation is that social media companies are … 
",https://www.embopress.org/doi/pdf/10.15252/embr.202051819,"DR Grimes - EMBO reports, 2020 - embopress.org",Cited by 4,All 5 versions
[PDF][PDF] Social Media as Vehicle for Conspiracy Beliefs on COVID-19,http://ejournals.facultas.at/index.php/digitalpsychology/article/download/1866/1638,"… Conspiracy in the time of corona: Automatic detection of covid-19 conspiracy theories
in social media and the news. Retrieved from https://arxiv.org/abs/2004.13783 Shi, H.,
Han, X., Jiang, N., Cao, Y., Alwalid, O., Gu, J., … & Zheng, C. (2020) … 
",http://ejournals.facultas.at/index.php/digitalpsychology/article/download/1866/1638,"A Goreis, OD Kothgassner - Digital Psychology, 2020 - ejournals.facultas.at",Cited by 1,All 2 versions
The spread of the pandemic of social media panic during the COVID-19 outbreak,https://www.ejeph.com/download/the-spread-of-the-pandemic-of-social-media-panic-during-the-covid-19-outbreak-8277.pdf,"… INFO ABSTRACT Received: 15 April 2020 Accepted: 13 May 2020 The outbreak of novel
COVID-19 has opened up different issues for social media including the life-endangering
consequences of supposed cures, misleading rumors, and conspiracy theories about the origin … 
",https://www.ejeph.com/download/the-spread-of-the-pandemic-of-social-media-panic-during-the-covid-19-outbreak-8277.pdf,"E Radwan, A Radwan - European Journal of Environment and Public …, 2020 - ejeph.com",Cited by 13,
"The Instagram Infodemic: Cobranding of Conspiracy Theories, Coronavirus Disease 2019 and Authority-Questioning Beliefs",https://www.liebertpub.com/doi/pdfplus/10.1089/cyber.2020.0663,"… A recent survey found that COVID-19-related beliefs were strongly linked with the belief in
conspiracy theories, and also showed a … and informed elected leaders for guidance on infection
control, our study adds to the growing literature suggesting that social media is contributing … 
",https://www.liebertpub.com/doi/pdfplus/10.1089/cyber.2020.0663,"EK Quinn, SS Fazel, CE Peters - Cyberpsychology, Behavior, and …, 2020 - liebertpub.com",,All 4 versions
[HTML][HTML] The covid-19 social media infodemic,https://www.nature.com/articles/s41598-020-73510-5,"… Studying the effect of the social media environment on the perception of polarizing topics is being
addressed also in the case of … are indeed being tackled by the scientific literature from multiple
perspectives including the dynamics of hatespeech and conspiracy theories 28,29 … 
",,"M Cinelli, W Quattrociocchi, A Galeazzi… - Scientific Reports, 2020 - nature.com",Cited by 350,All 17 versions
"[HTML][HTML] Misinformation, manipulation, and abuse on social media in the era of COVID-19",https://link.springer.com/article/10.1007/s42001-020-00094-5,"… “Conspiracy in the Time of Corona: Automatic Detection of Emerging COVID-19 Conspiracy
Theories in Social Media and the News” by Shahsavari … Conspiracy in the time of corona: Automatic
detection of emerging COVID-19 conspiracy theories in social media and the news … 
",,"E Ferrara, S Cresci, L Luceri - Journal of Computational Social Science, 2020 - Springer",Cited by 9,All 9 versions
The covid-19 social media infodemic reflects uncertainty and state-sponsored propaganda,https://arxiv.org/pdf/2007.09682,"… For example, “Plandemic,” a viral movie promoting conspiracy theories about
COVID-19, was primarily spread via social media, which hosts user-generated
content of varying reliability [17]. Similar concerns apply to content … 
",https://arxiv.org/pdf/2007.09682,"DA Broniatowski, D Kerchner, F Farooq… - arXiv preprint arXiv …, 2020 - arxiv.org",Cited by 6,All 3 versions
The pandemic of social media panic travels faster than the COVID-19 outbreak,https://academic.oup.com/jtm/article-abstract/27/3/taaa031/5775501,"… 2019 (COVID-19) in China, misleading rumours and conspiracy theories about the origin circulated
the globe paired with fearmongering, racism and mass purchase of face masks, all closely linked
to the new 'infomedia' ecosystems of the 21st century marked by social media … 
",,"A Depoux, S Martin, E Karafillakis, R Preet… - 2020 - academic.oup.com",Cited by 400,All 9 versions
Characterizing social media manipulation in the 2020 US presidential election,https://journals.uic.edu/ojs/index.php/fm/article/download/11431/9993,"… there is no established definition of distorted narrative in the literature, authors typically refer to
that as information shared on social media that is … and what is false to qualify a piece of information
as fake news (or not), in this study we focus on conspiracy theories, another typical … 
",,"E Ferrara, H Chang, E Chen, G Muric, J Patel - First Monday, 2020 - journals.uic.edu",Cited by 10,All 4 versions
[HTML][HTML] Medical conspiracy theories: cognitive science and implications for ethics,https://link.springer.com/article/10.1007/s11019-020-09951-6,"… Conspiracy theories spread very easily. Although the technological advance of social media
plays a significant role in their dissemination, it is still true that, even in a preindustrial world without
media technologies, conspiracy theories were easily widespread by word of mouth … 
",,"G Andrade - Medicine, Health Care and Philosophy, 2020 - Springer",Cited by 13,All 7 versions
"The dark side of social movements: Social identity, non-conformity, and the lure of conspiracy theories",https://www.researchgate.net/profile/Jay-Van-Bavel/publication/338982225_The_dark_side_of_social_movements_Social_identity_non-conformity_and_the_lure_of_conspiracy_theories/links/5f9218a3458515b7cf96ac07/The-dark-side-of-social-movements-Social-identity-non-conformity-and-the-lure-of-conspiracy-theories.pdf,"… Closing remarks. Conspiracy theories pose a threat to democratic systems. With the development
of social media, conspiracy theorists acquired a new platform to spread unsubstantiated claims
at an unprecedented rate and organize dangerous social movements … 
",https://www.researchgate.net/profile/Jay-Van-Bavel/publication/338982225_The_dark_side_of_social_movements_Social_identity_non-conformity_and_the_lure_of_conspiracy_theories/links/5f9218a3458515b7cf96ac07/The-dark-side-of-social-movements-Social-identity-non-conformity-and-the-lure-of-conspiracy-theories.pdf,"A Sternisko, A Cichocka, JJ Van Bavel - Current opinion in psychology, 2020 - Elsevier",Cited by 17,All 15 versions
[HTML][HTML] Not just conspiracy theories: Vaccine opponents and proponents add to the COVID-19 'infodemic'on Twitter,https://misinforeview.hks.harvard.edu/article/not-just-conspiracy-theories-vaccine-opponents-and-pro-ponents-add-to-the-covid-19-infodemic-on-twitter/,"… With the 'infodemic,' health information is competing against a veritable “tsunami” of competing
claims, many of which are amplified across social media with greater speed and reach (Zarocostas …
These sources typically promote conspiracy theories and other fringe opinions … 
",,"AM Jamison, DA Broniatowski… - Harvard …, 2020 - misinforeview.hks.harvard.edu",Cited by 4,All 2 versions
Is science failing to pass its message to people? Reasons and risks behind conspiracy theories and myths regarding COVID-19,https://papers.ssrn.com/sol3/papers.cfm?abstract_id=3577662,"… myths and conspiracy theories circulating in social media and mass media channels. In addition
to myth believing as means to alleviate anxiety and uncertainty, other … conspiracy theories, the
current study found that 28% of the participants used social media … 
",,"M Constantinou, A Kagialis… - … behind conspiracy theories …, 2020 - papers.ssrn.com",Cited by 5,
[BOOK][B] Routledge handbook of conspiracy theories,https://books.google.com/books?hl=en&lr=&id=8DjSDwAAQBAJ&oi=fnd&pg=PT27&dq=%22social+media%22+AND+%22conspiracy+theories%22&ots=TENn-08oie&sig=x5JL-wnFMQjfoDHch4jsFg9a5iY,"… Her research interests cover attitudes and conspiracy beliefs in different behavioural domains,
including intergroup relationships, political psychology and the social media context … She is
interested in science scepticism, conspiracy theories, gender and collective action … 
",,"M Butter, P Knight - 2020 - books.google.com",Cited by 19,
"The viral power of fake news: Subjective social insecurity, COVID-19 damaging misinformation, and baseless conspiracy theories",https://www.ceeol.com/search/article-detail?id=857522,"… known and engage the viewers, taking into account the notable extent and swiftness of news
flow facilitated by social media … Public Knowledge, Statista, and the Univer- sity of Canberra, we
performed analyses and made estimates regarding conspiracy theories and incorrect … 
",,"G Sheares, R Miklencicova, M Grupac - Linguistic and Philosophical …, 2020 - ceeol.com",Cited by 8,All 5 versions
[PDF][PDF] Conspiracy theories in times of crisis and their societal effects: Case “corona”,https://psyarxiv.com/y5grn/download?format=pdf,"Page 1. 1 SOCIETAL EFFECTS OF COVID-19 CONSPIRACY THEORIES Conspiracy
theories and their societal effects during the COVID-19 pandemic … Page 2. SOCIETAL
EFFECTS OF COVID-19 CONSPIRACY THEORIES 2 Abstract … 
",https://psyarxiv.com/y5grn/download?format=pdf,"L Pummerer, K Sassenberg - 2020 - psyarxiv.com",Cited by 10,All 4 versions
The rise of the Pashtun Protection Movement (PTM): Polemics and conspiracy theories,https://www.tandfonline.com/doi/abs/10.1080/03068374.2020.1752568,"… In essence, both parties have resorted to conspiracy theories of one sort or the other … These include
the increasingly wide-scale use of social media for political activism and awareness; various
impacts on merger of FATA with Khyber Pakhtunkhwa; and also the successful … 
",,"AR Shah - Asian Affairs, 2020 - Taylor & Francis",Cited by 3,All 2 versions
Social media use during social distancing,http://pu.edu.pk/MHH-COVID-19/Articles/Article39.pdf,"… 13. Ghaffary S, Heilweil R. Facebook doubles down on re- moving coronavirus conspiracy theories.
https://www.vox .com/recode/2020/1/31/21115589/coronavirus-wuhan-china- myths-hoaxes-
facebook-social-media-tiktok-twitter-wechat (accessed March 22, 2020). 14 … 
",http://pu.edu.pk/MHH-COVID-19/Articles/Article39.pdf,BK Wiederhold - 2020 - liebertpub.com,Cited by 48,All 7 versions
[HTML][HTML] Dimensions of Misinformation About the HPV Vaccine on Instagram: Content and Network Analysis of Social Media Characteristics,https://www.jmir.org/2020/12/e21451/,"… themes and ideas that are shared in antivaccine communities, including vaccine inefficacy, civil
liberties, alternative medicine, ideology, and conspiracy theories [27 … This coding method has
been used widely in social media content analysis [4,5]. Our full codebook is provided as … 
",,"PM Massey, MD Kearney, MK Hauer, P Selvan… - Journal of medical …, 2020 - jmir.org",,All 9 versions
Impacts of rumors and conspiracy theories surrounding COVID-19 on preparedness programs,https://www.cambridge.org/core/services/aop-cambridge-core/content/view/0FB0A6C6871F9C62A264842A3BB0C01E/S1935789320003250a.pdf/div-class-title-impacts-of-rumors-and-conspiracy-theories-surrounding-covid-19-on-preparedness-programs-div.pdf,"… These data are based on convenience sampling. The data I analyze herein also come from the
content analysis of mainstream social media reports that I began to undertake in January 2020.
For providing an historical outline of rumors and conspiracy theories, I borrow from the … 
",https://www.cambridge.org/core/services/aop-cambridge-core/content/view/0FB0A6C6871F9C62A264842A3BB0C01E/S1935789320003250a.pdf/div-class-title-impacts-of-rumors-and-conspiracy-theories-surrounding-covid-19-on-preparedness-programs-div.pdf,"I Ali - Disaster Medicine and Public Health Preparedness, 2020 - cambridge.org",Cited by 5,All 7 versions
From pizzagate to the great replacement: The globalization of conspiracy theories,https://link.springer.com/chapter/10.1007/978-3-030-43005-4_3,"This chapter discusses the circulation of conspiracy theories evolving from concoctions of Internet subcultures to global topics of public conversation and political mobilization. The examples provided are those of the Pizzagate and QAnon conspiracy theories, which …",,"G Cosentino - Social Media and the Post-Truth World Order, 2020 - Springer",Cited by 5,All 2 versions
"Cultural orientation, power, belief in conspiracy theories, and intentions to reduce the spread of COVID‐19",https://onlinelibrary.wiley.com/doi/pdf/10.1111/bjso.12397,"… and engagement with behaviours that reduce the spread of COVID‐19 would be mediated by
both belief in COVID‐19 conspiracy theories and feelings of … were recruited for this correlational
study (from 4 to 13 April 2020) via posts on social media (n = 413) and Reddit forums (n … 
",https://onlinelibrary.wiley.com/doi/pdf/10.1111/bjso.12397,"M Biddlestone, R Green… - British Journal of Social …, 2020 - Wiley Online Library",Cited by 50,All 15 versions
The internet and the spread of conspiracy content,https://iris.unito.it/handle/2318/1733997,"… This chapter aims at describing how conspiracy theories propagate online and with which effects,
by making reference to existing literature in the related fields of research and exploring a … Dawkins
1976) to its recent reconsideration in social media and communication studies (cf … 
",,S Stano - 2020 - iris.unito.it,Cited by 5,
"Sourcing and automation of political news and information over social media in the United States, 2016-2018",https://www.tandfonline.com/doi/pdf/10.1080/10584609.2019.1663322,"… During the 2016 presidential election in the United States, a wide range of politically
and economically motivated actors exploited social media platforms to spread
propaganda, hate speech, and conspiracy theories to voters … 
",https://www.tandfonline.com/doi/pdf/10.1080/10584609.2019.1663322,"S Bradshaw, PN Howard, B Kollanyi… - Political …, 2020 - Taylor & Francis",Cited by 24,All 2 versions
Conspiracism on social media: An agenda melding of group-mediated deceptions,https://www.ingentaconnect.com/content/intellect/mcp/2020/00000016/00000002/art00001,"… A sample of 476 students from four European universities participated in a survey about conspiracy
theories in social media group discussions … DISCUSSION This exploratory study yields some
interesting findings related to social media interactions and conspiracy theories … 
",,"P Bantimaroudis, M Sideri, D Ballas… - … Journal of media & …, 2020 - ingentaconnect.com",Cited by 1,All 2 versions
Dialogic content analysis of misinformation about COVID-19 on social media in Pakistan,https://journals.umt.edu.pk/index.php/llr/article/download/960/498,"… the Internet regulations. Keywords: Misinformation, conspiracy theories, social media,
covid-19, racism, social media education Introduction Pakistan is a country of over
212 million people with a fast-growing Internet market … 
",https://journals.umt.edu.pk/index.php/llr/article/download/960/498,"MS Rafi - Linguistics and Literature Review, 2020 - journals.umt.edu.pk",Cited by 9,All 2 versions
[HTML][HTML] Socio-Psychological Predictors of Belief in Conspiracy Theories of the Origin of COVID-19 and Involvement in Social Media,https://psyjournals.ru/en/social_psy/2020/n4/Nestik_et_al.shtml,Objective. Search for socio-psychological antecedents for the individual's belief in conspiracy theories of the origin of the pandemic. Revealing the dynamics of Internet users' attitudes to the coronavirus pandemic in March-early June 2020. Background. As part of the …,,"TA Nestik, OS Deyneka - Social Psychology and Society, 2020 - psyjournals.ru",,All 2 versions
